{"candidateId":"ch17.en.r5.20261002.r2","findings":[],"reviewId":"ch17.en.r5.20261002.r2.technical","reviewer":{"accessBoundary":{"declaredArtifactIdsRead":["context-manifest","prompt","review-bundle","review-record-schema"],"mode":"declared-read-only"},"completedAt":"2026-10-02T10:20:47.750Z","contextId":"ch17_v5_r2_technical","freshContext":true,"model":"gpt-6.1-sol","reasoning":"max","startedAt":"2026-10-02T10:12:47.099Z"},"role":"technical-pedagogical","schemaVersion":1,"scopeId":"ch17.en.20261002.r2","surfaceAssessments":[{"findingIds":[],"judgment":"pass","rationale":"All 129 extraction values match the isolated HTML and provenance records. Paired captions, table rows, cards and term definitions follow rendered roles rather than added rescue context. The requirement correctly limits this document to faithful extraction.","roleRequirement":"The audit-only extraction view must preserve exact accessible values and legitimate rendered isolation groups from the frozen course HTML; it adds no context or teaching content and must match extraction provenance.","surfaceId":"built.isolation"},{"findingIds":[],"judgment":"pass","rationale":"The complete HTML retains the mathematical annotations, ten exact Rust excerpts, measured histogram records, expected variance sequences and reference terms. All 27 histogram labels agree with their shared template and trace. The inventory and frozen requirements cover the affected English roles without omitting a distinct teaching commitment.","roleRequirement":"Explain why trainable dense weights need nonidentical reproducible starts and width-aware scales; work through the exact seed-17 matrix and variance/bound, state dense near-linear independence assumptions and finite-sample limits, preserve SplitMix64/f64 semantics, transactional validation and stable-name versus leaf identity, bounded paper claims and parameter-kind policies, distinguish measured histograms from expected linear propagation, give optional nonprediction practice with checked results, and hand off token-table lookup semantics without claiming its shape convention follows from dense variance. Render all affected math, source excerpts, diagram/accessibility and reference surfaces coherently without losing learner atoms.","surfaceId":"built.lesson"},{"findingIds":[],"judgment":"pass","rationale":"The reading sequence explains symmetry and scale before the seed-17 solution, derives the width rule before history, then supplies the zero-gradient contrast, controlled figure and optional checked practice. The handoff separates construction from lookup and updates. The requirement covers the commitments necessary to reproduce this behavior.","roleRequirement":"Explain why trainable dense weights need nonidentical reproducible starts and width-aware scales; work through the exact seed-17 matrix and variance/bound, state dense near-linear independence assumptions and finite-sample limits, preserve SplitMix64/f64 semantics, transactional validation and stable-name versus leaf identity, bounded paper claims and parameter-kind policies, distinguish measured histograms from expected linear propagation, give optional nonprediction practice with checked results, and hand off token-table lookup semantics without claiming its shape convention follows from dense variance.","surfaceId":"reading.main"},{"findingIds":[],"judgment":"pass","rationale":"The English projection agrees with the lesson on exact samples, conditional symmetry, width formulas, represented arithmetic, validation precedence, paper boundaries and token-table policy. Its exercises and trace commitments match the executable evidence. The requirement covers both semantic agreement and the declared projection boundary.","roleRequirement":"Explain why trainable dense weights need nonidentical reproducible starts and width-aware scales; work through the exact seed-17 matrix and variance/bound, state dense near-linear independence assumptions and finite-sample limits, preserve SplitMix64/f64 semantics, transactional validation and stable-name versus leaf identity, bounded paper claims and parameter-kind policies, distinguish measured histograms from expected linear propagation, give optional nonprediction practice with checked results, and hand off token-table lookup semantics without claiming its shape convention follows from dense variance. Preserve the English-only contract projection and unchanged mathematical/code literals; later Russian fields are outside this projection.","surfaceId":"source.contract-en"},{"findingIds":[],"judgment":"pass","rationale":"The source distinguishes target, measured and expected variances; its seed fixtures, SiLU derivative, fan changes, transaction boundary and leaf identities match Rust. Historical claims remain bounded by the supplied primary-source inspection. Optional tasks have explained answers. The requirement covers these commitments and the explicit shape-convention handoff.","roleRequirement":"Explain why trainable dense weights need nonidentical reproducible starts and width-aware scales; work through the exact seed-17 matrix and variance/bound, state dense near-linear independence assumptions and finite-sample limits, preserve SplitMix64/f64 semantics, transactional validation and stable-name versus leaf identity, bounded paper claims and parameter-kind policies, distinguish measured histograms from expected linear propagation, give optional nonprediction practice with checked results, and hand off token-table lookup semantics without claiming its shape convention follows from dense variance.","surfaceId":"source.lesson"},{"findingIds":[],"judgment":"pass","rationale":"The ten definitions concern concepts actually taught here. Equal downstream treatment, distribution rather than sample variance, raw generator state and replay prerequisites remain explicit. The concise-reference requirement covers the relevant commitments without requiring a second derivation.","roleRequirement":"Define only Chapter17 initialization concepts concisely and accurately, retaining conditions for symmetry, reproduction, target variance and width-aware scale without turning the reference into a second lesson.","surfaceId":"source.sheet"},{"findingIds":[],"judgment":"pass","rationale":"The title names trainable starting weights, reproducibility and scale. Its identification-only requirement appropriately excludes training-quality claims and prediction tasks.","roleRequirement":"Identify reproducible trainable-weight initialization as the chapter topic, with no learner prediction request.","surfaceId":"unit.001"},{"findingIds":[],"judgment":"pass","rationale":"The description names symmetry, width-aware scale and named-weight replay while separating sampled spread from expected linear variance. The standalone requirement covers those bounded promises.","roleRequirement":"State the initialization problem and bounded solution in standalone course/SEO copy without claiming measured decoder stability.","surfaceId":"unit.002"},{"findingIds":[],"judgment":"pass","rationale":"The actual meta description preserves the lesson description's initialization referents and measured-versus-expected distinction. Its independent-search-copy requirement covers the supported chapter capabilities.","roleRequirement":"Describe the chapter problem and initialization solution accurately when read independently from the page.","surfaceId":"unit.003"},{"findingIds":[],"judgment":"pass","rationale":"The associated section explains why a correct reverse pass cannot choose useful starting weights and then works through the sample. The contextual requirement fits this problem-first heading.","roleRequirement":"Orient the learner to the concrete starting-weight problem and explained worked solution in its associated section; this contextual navigation heading need not restate the whole page concept and must not request an outcome prediction.","surfaceId":"unit.004"},{"findingIds":[],"judgment":"pass","rationale":"The section connects both widths to the distribution variance compromise and states its assumptions. The requirement correctly treats the heading as orientation, not a complete theorem.","roleRequirement":"Orient the learner to the distribution variance rule and its assumptions in its associated section; this contextual navigation heading need not restate the whole page concept and must not request an outcome prediction.","surfaceId":"unit.005"},{"findingIds":[],"judgment":"pass","rationale":"The following symbol table defines input rows, output columns and both connection counts before construction details. The contextual requirement covers that coordinate-reading role.","roleRequirement":"Orient the learner to the meanings of the matrix coordinates and widths, with their Rust connections in its associated section; this contextual navigation heading need not restate the whole page concept and must not request an outcome prediction.","surfaceId":"unit.006"},{"findingIds":[],"judgment":"pass","rationale":"The history proceeds from Bengio's random features to Glorot's scale analysis and repeated Transformer projections, with explicit attribution limits. The requirement matches this historical orientation.","roleRequirement":"Orient the learner to the bounded neural-language-model and initialization history in its associated section; this contextual navigation heading need not restate the whole page concept and must not request an outcome prediction.","surfaceId":"unit.007"},{"findingIds":[],"judgment":"pass","rationale":"The section derives equal nonzero SiLU gradient columns and inspects safe named-parameter construction. Its requirement correctly covers both kinds of Rust evidence announced by the heading.","roleRequirement":"Orient the learner to the related Rust evidence and safe parameter-construction boundary in its associated section; this contextual navigation heading need not restate the whole page concept and must not request an outcome prediction.","surf